{
  "receiptId": "receipt_github_pr_001",
  "targetType": "candidate_claim",
  "targetId": "cand_flagged_001",
  "claim": "autoLearn true can introduce unsupported output into the graph",
  "status": "canonical",
  "workspaceId": "default",
  "provenance": {
    "provenanceId": "prov_github_pr_4821",
    "sourceRef": "github://agiulucom42-del/axiom/pull/4821",
    "sourceTitle": "AXIOM PR #4821",
    "sourceType": "github",
    "sourceSubType": "merged_pr",
    "actor": "axiom-bot",
    "timestamp": "2026-06-02T08:10:00Z",
    "confidence": 0.94,
    "workspaceId": "default",
    "trustPolicyVersion": "0.8.0"
  },
  "trustPolicyVersion": "0.8.0",
  "confidence": 0.94,
  "auditTrail": [
    {
      "auditId": "audit_learn_001",
      "eventType": "LEARN",
      "targetType": "edge",
      "targetId": "autoLearn|CAUSES|unsupported output can enter graph",
      "workspaceId": "default",
      "actor": "axiom-bot",
      "timestamp": "2026-06-02T08:11:00Z",
      "sourceRef": "github://agiulucom42-del/axiom/pull/4821",
      "provenanceId": "prov_github_pr_4821",
      "trustPolicyVersion": "0.8.0",
      "details": {
        "nodesAdded": 2,
        "edgesAdded": 1,
        "source": "github"
      }
    }
  ],
  "conflict": null,
  "candidateClaim": {
    "candidateId": "cand_flagged_001",
    "claim": "autoLearn true can introduce unsupported output into the graph"
  },
  "canonical": true,
  "generatedAt": "2026-06-02T08:15:00Z"
}
